<?xml version="1.0"?>

<!--
 Hive Colony Framework
 Copyright (C) 2008 Hive Solutions Lda.

 This file is part of Hive Colony Framework.

 Hive Colony Framework is free software: you can redistribute it and/or modify
 it under the terms of the GNU General Public License as published by
 the Free Software Foundation, either version 3 of the License, or
 (at your option) any later version.

 Hive Colony Framework is distributed in the hope that it will be useful,
 but WITHOUT ANY WARRANTY; without even the implied warranty of
 MERCHANTABILITY or FITNESS FOR A PARTICULAR PURPOSE. See the
 GNU General Public License for more details.

 You should have received a copy of the GNU General Public License
 along with Hive Colony Framework. If not, see <http://www.gnu.org/licenses/>.
-->

<!-- 
 __author__    = Tiago Silva <tsilva@hive.pt>
 __version__   = 1.0.0
 __revision__  = $LastChangedRevision: 2101 $
 __date__      = $LastChangedDate: 2008-10-21 13:43:28 +0100 (Ter, 21 Out 2008) $
 __copyright__ = Copyright (c) 2008 Hive Solutions Lda.
 __license__   = GNU General Public License (GPL), Version 3
-->

<output_configuration xsi:schemaLocation="http://www.hive.pt ../output_configuration.xsd"
	xmlns="http://www.hive.pt" xmlns:xsi="http://www.w3.org/2001/XMLSchema-instance">
	<domain_entities>
		<domain_entity><!-- ContactInformation -->
			<name>ContactInformation</name>
			<table>contact_informations</table>
			<internal_entity>contact_information</internal_entity>
			<attributes>
				<attribute><!-- id -->
					<name>id</name>
					<type>Integer</type>
					<primary_key>true</primary_key>
				</attribute>
				<attribute><!-- telephone -->
					<name>telephone</name>
					<internal_attribute>telephone</internal_attribute>
					<type>String(255)</type>
				</attribute>
				<attribute><!-- mobilePhone -->
					<name>mobilePhone</name>
					<internal_attribute>mobilePhone</internal_attribute>
					<type>String(255)</type>
				</attribute>
				<attribute><!-- fax -->
					<name>fax</name>
					<internal_attribute>fax</internal_attribute>
					<type>String(255)</type>
				</attribute>
				<attribute><!-- email -->
					<name>email</name>
					<internal_attribute>email</internal_attribute>
					<type>String(255)</type>
				</attribute>
				<attribute><!-- webPageUrl -->
					<name>webPageUrl</name>
					<internal_attribute>webPageUrl</internal_attribute>
					<type>String(255)</type>
				</attribute>
				<attribute><!-- person -->
					<name>person</name>
					<internal_attribute>customer</internal_attribute>
					<type>Integer</type>
					<referenced_domain_entity>
						<name>Person</name>
						<multiplicity>one-to-one</multiplicity>
					</referenced_domain_entity>
				</attribute>
				<attribute><!-- supplier -->
					<name>company</name>
					<internal_attribute>supplier</internal_attribute>
					<type>Integer</type>
					<referenced_domain_entity>
						<name>Company</name>
						<multiplicity>one-to-one</multiplicity>
					</referenced_domain_entity>
				</attribute>
			</attributes>
		</domain_entity>
	</domain_entities>
</output_configuration>